{
  "conditions": [
    {
      "left": "Distance(A, Line(B, C))",
      "operator": "=",
      "right": 15
    },
    {
      "left": "Distance(A, Line(C, D))",
      "operator": "=",
      "right": 18
    },
    {
      "left": "Distance(A, Line(B, D))",
      "operator": "=",
      "right": 10
    },
    {
      "left": "u",
      "operator": ">",
      "right": "0"
    },
    {
      "left": "v",
      "operator": ">",
      "right": "0"
    },
    {
      "left": "h",
      "operator": ">",
      "right": "0"
    },
    {
      "left": "v - u",
      "operator": ">",
      "right": "0"
    }
  ],
  "constructions": [
    {
      "expression": "Point(-u, 0)",
      "name": "A"
    },
    {
      "expression": "Point(u, 0)",
      "name": "B"
    },
    {
      "expression": "Point(v, h)",
      "name": "C"
    },
    {
      "expression": "Point(-v, h)",
      "name": "D"
    }
  ],
  "id": "AIME-2021-I-09",
  "target": "sqrt(2) * Area(A, B, C, D)",
  "variables": [
    "u",
    "v",
    "h"
  ]
}
