{
  "conditions": [
    {
      "left": "t",
      "operator": ">",
      "right": "0"
    },
    {
      "left": "t",
      "operator": "<",
      "right": "pi/2"
    },
    {
      "left": "Distance(A,B)",
      "operator": "=",
      "right": "4"
    }
  ],
  "constructions": [
    {
      "expression": "Point(0,0)",
      "name": "O1"
    },
    {
      "expression": "Point(6,0)",
      "name": "O2"
    },
    {
      "expression": "Point(2,0)",
      "name": "P"
    },
    {
      "expression": "Circle(O1,2)",
      "name": "C1"
    },
    {
      "expression": "Circle(O2,4)",
      "name": "C2"
    },
    {
      "expression": "Point(2+cos(t),-sin(t))",
      "name": "Q"
    },
    {
      "expression": "Line(P,Q)",
      "name": "L"
    },
    {
      "expression": "Intersect(L,C1,exclude=P)",
      "name": "A"
    },
    {
      "expression": "Intersect(L,C2,exclude=P)",
      "name": "B"
    }
  ],
  "id": "JMO-2009-PRE-02",
  "target": "Area(P, Q, A)",
  "variables": [
    "t"
  ]
}
