{
  "conditions": [
    {
      "left": "Distance(A, B)",
      "operator": "=",
      "right": 13
    },
    {
      "left": "Distance(B, C)",
      "operator": "=",
      "right": 14
    },
    {
      "left": "Distance(C, A)",
      "operator": "=",
      "right": 15
    },
    {
      "left": "Distance(O1, T)",
      "operator": "=",
      "right": "r1"
    },
    {
      "left": "Distance(M, T)",
      "operator": "=",
      "right": "r2"
    },
    {
      "left": "Distance(O1, M)",
      "operator": "=",
      "right": "r1 + r2"
    },
    {
      "left": "r1",
      "operator": ">",
      "right": "0"
    },
    {
      "left": "r2",
      "operator": ">",
      "right": "0"
    },
    {
      "left": "t",
      "operator": ">",
      "right": "0"
    }
  ],
  "constructions": [
    {
      "expression": "Point(5, 12)",
      "name": "A"
    },
    {
      "expression": "Point(0, 0)",
      "name": "B"
    },
    {
      "expression": "Point(14, 0)",
      "name": "C"
    },
    {
      "expression": "Circumcircle(A, B, C)",
      "name": "Gamma"
    },
    {
      "expression": "Center(Gamma)",
      "name": "O"
    },
    {
      "expression": "Radius(Gamma)",
      "name": "R"
    },
    {
      "expression": "Point(7, -4)",
      "name": "M"
    },
    {
      "expression": "Point(107 / 15, 0)",
      "name": "S"
    },
    {
      "expression": "Point(5 + t * (107 / 15 - 5), 12 * (1 - t))",
      "name": "T"
    },
    {
      "expression": "Point(7 - 2 * (R - r1) / R, 33 / 8 + 63 / 8 * (R - r1) / R)",
      "name": "O1"
    },
    {
      "expression": "Circle(O1, r1)",
      "name": "omega1"
    },
    {
      "expression": "Circle(M, r2)",
      "name": "omega2"
    }
  ],
  "id": "HMMT-2014-FEB-GEO-10",
  "target": "r2",
  "variables": [
    "r1",
    "r2",
    "t"
  ]
}
