{
  "id": "AIME-2014-II-10",
  "variables": [
    "x",
    "y",
    "u",
    "v"
  ],
  "constructions": [
    {
      "name": "Z",
      "expression": "Point(2014, 0)"
    },
    {
      "name": "W1",
      "expression": "Point(x, y)"
    },
    {
      "name": "W2",
      "expression": "Point(u, v)"
    }
  ],
  "conditions": [
    {
      "left": "x**2-y**2+2014*x+2014**2",
      "operator": "=",
      "right": 0
    },
    {
      "left": "2*x*y+2014*y",
      "operator": "=",
      "right": 0
    },
    {
      "left": "x**2+y**2",
      "operator": ">",
      "right": 0
    },
    {
      "left": "(x+2014)**2+y**2",
      "operator": ">",
      "right": 0
    },
    {
      "left": "u**2-v**2+2014*u+2014**2",
      "operator": "=",
      "right": 0
    },
    {
      "left": "2*u*v+2014*v",
      "operator": "=",
      "right": 0
    },
    {
      "left": "u**2+v**2",
      "operator": ">",
      "right": 0
    },
    {
      "left": "(u+2014)**2+v**2",
      "operator": ">",
      "right": 0
    },
    {
      "left": "y",
      "operator": ">",
      "right": 0
    },
    {
      "left": "v",
      "operator": "<",
      "right": 0
    }
  ],
  "target": "Distance(W2, Z)"
}
