{
  "conditions": [
    {
      "left": "h",
      "operator": ">",
      "right": "0"
    },
    {
      "left": "Distance(O,P)",
      "operator": "=",
      "right": "Distance(O,A)"
    }
  ],
  "constructions": [
    {
      "expression": "Point(0,0)",
      "name": "A"
    },
    {
      "expression": "Point(11,0)",
      "name": "B"
    },
    {
      "expression": "Point(5,0)",
      "name": "Q"
    },
    {
      "expression": "Point(11/2,h)",
      "name": "O"
    },
    {
      "expression": "Point(9/2,-h)",
      "name": "P"
    }
  ],
  "id": "JMO-2011-PRE-04",
  "target": "Distance(O,A)",
  "variables": [
    "h"
  ]
}
