{
  "conditions": [
    {
      "left": "Distance(O, A)",
      "operator": "=",
      "right": "r"
    },
    {
      "left": "Distance(O, B)",
      "operator": "=",
      "right": "r"
    },
    {
      "left": "Distance(O, C)",
      "operator": "=",
      "right": "r"
    },
    {
      "left": "Distance(O, D)",
      "operator": "=",
      "right": "r"
    },
    {
      "left": "Distance(O, E)",
      "operator": "=",
      "right": "r"
    },
    {
      "left": "Distance(O, F)",
      "operator": "=",
      "right": "r"
    },
    {
      "left": "Angle(B, P, C)",
      "operator": "=",
      "right": "((50 * pi / 180)*(101/100))"
    },
    {
      "left": "Angle(C, Q, D)",
      "operator": "=",
      "right": "((45 * pi / 180)*(101/100))"
    },
    {
      "left": "Angle(D, R, E)",
      "operator": "=",
      "right": "((40 * pi / 180)*(99/100))"
    },
    {
      "left": "Angle(E, S, F)",
      "operator": "=",
      "right": "((35 * pi / 180)*(101/100))"
    },
    {
      "left": "r",
      "operator": ">",
      "right": "0"
    },
    {
      "left": "Area(A, B, C)",
      "operator": ">",
      "right": "0"
    },
    {
      "left": "Area(A, C, D)",
      "operator": ">",
      "right": "0"
    },
    {
      "left": "Area(A, D, E)",
      "operator": ">",
      "right": "0"
    },
    {
      "left": "g1",
      "operator": ">",
      "right": "0"
    },
    {
      "left": "g2",
      "operator": ">",
      "right": "0"
    },
    {
      "left": "g3",
      "operator": ">",
      "right": "0"
    },
    {
      "left": "g4",
      "operator": ">",
      "right": "0"
    },
    {
      "left": "g5",
      "operator": ">",
      "right": "0"
    },
    {
      "left": "g1 + g2 + g3 + g4 + g5",
      "operator": "<",
      "right": "2 * pi"
    },
    {
      "predicate": "ConvexPolygon([A, B, C, D, E, F])"
    }
  ],
  "constructions": [
    {
      "expression": "Point(0, 0)",
      "name": "O"
    },
    {
      "expression": "Point(r, 0)",
      "name": "A"
    },
    {
      "expression": "Point(r * cos(g1), r * sin(g1))",
      "name": "B"
    },
    {
      "expression": "Point(r * cos(g1 + g2), r * sin(g1 + g2))",
      "name": "C"
    },
    {
      "expression": "Point(r * cos(g1 + g2 + g3), r * sin(g1 + g2 + g3))",
      "name": "D"
    },
    {
      "expression": "Point(r * cos(g1 + g2 + g3 + g4), r * sin(g1 + g2 + g3 + g4))",
      "name": "E"
    },
    {
      "expression": "Point(r * cos(g1 + g2 + g3 + g4 + g5), r * sin(g1 + g2 + g3 + g4 + g5))",
      "name": "F"
    },
    {
      "expression": "Circle(O, r)",
      "name": "omega"
    },
    {
      "expression": "Intersect(Line(A, B), Line(D, C))",
      "name": "P"
    },
    {
      "expression": "Intersect(Line(B, C), Line(E, D))",
      "name": "Q"
    },
    {
      "expression": "Intersect(Line(C, D), Line(F, E))",
      "name": "R"
    },
    {
      "expression": "Intersect(Line(D, E), Line(A, F))",
      "name": "S"
    },
    {
      "expression": "Intersect(Line(B, E), Line(C, F))",
      "name": "T"
    }
  ],
  "id": "JMO-2016-PRE-03",
  "target": "180 * Angle(B, T, C) / pi",
  "variables": [
    "r",
    "g1",
    "g2",
    "g3",
    "g4",
    "g5"
  ]
}
